date,timestamp,headline,description,category,link,relevance_score
2025-08-28,,US Fed Reserve Chair Powell opens door to September rate cut,Powell’s remarks offered little guidance about how soon or how quickly rates might continue to move lower.,,https://www.aljazeera.com/economy/2025/8/22/us-fed-reserve-chair-powell-opens-door-to-september-rate-cut,2
2025-08-28,,Chip giant Nvidia’s sales rise 56% in boost for AI boom,"US chipmaker reports revenue of $46.74bn for second quarter, defying fears that AI may be overhyped.",,https://www.aljazeera.com/economy/2025/8/28/chip-giant-nvidias-sales-rise-56-in-boost-for-ai-boom,1
2025-08-28,,Behind India’s massive Russian oil imports: Asia’s richest man,Reliance’s Russian crude imports have soared from 3 percent before the war in Ukraine to 50 percent now.,,https://www.aljazeera.com/economy/2025/8/22/behind-indias-massive-russian-oil-imports-asias-richest-man,1
2025-08-28,,Canada to ease most retaliatory tariffs against United States,Prime Minister Mark Carney says most Canadian goods will be exempted from US tariffs while some sectoral duties remain.,,https://www.aljazeera.com/news/2025/8/22/canada-to-ease-most-retaliatory-tariffs-against-united-states,1
2025-08-28,,Trump threatens to fire US Fed Governor Lisa Cook,"Cook, who has been accused of mortgage fraud, says she will not be ‘bullied’ into resigning by the president.",,https://www.aljazeera.com/economy/2025/8/22/trump-threatens-to-fire-us-fed-governor-lisa-cook,1
2025-08-28,,"US DOJ to probe Fed Reserve’s Cook, urges Powell to remove her: Report","Cook, who has been accused of mortgage fraud, has said she will not be bullied by Trump into resigning.",,https://www.aljazeera.com/economy/2025/8/21/us-doj-to-probe-fed-reserves-cook-urges-powell-to-remove-her-report,1
2025-08-28,,Walmart scoops customers from rivals but warns inventory cost is rising,Second-quarter results showed that the retailer has continued to benefit from price sensitivity among US consumers.,,https://www.aljazeera.com/economy/2025/8/21/walmart-scoops-customers-from-rivals-but-warns-inventory-cost-is-rising,0
